timestamp,order_id,user_query,intent,expected_answer,ai_answer,label,failure_reason,recommended_fix,latency_ms,est_tokens,est_cost_usd,data_used
2026-06-09T18:45:21.809576,ORD-4582,Where is my refund?,refund_status,"Return received 2026-06-05. Refund of ₹2,499 initiated 2026-06-07 via UPI. Expected by 2026-06-14 (5–7 business days).","I checked Order ORD-4582. Your return was received on 2026-06-05, and your refund of ₹2,499 was initiated on 2026-06-07 to your UPI. Refunds to UPI take 5-7 business days after refund initiation, so you should receive it by 2026-06-14.",Grounded,Answer is supported by available data. Key facts match mock data.,No fix needed. Answer is correct and grounded in data.,377.32,43,8.6e-05,"order, return, refund, policy"
2026-06-09T18:45:21.810105,ORD-4582,My return was picked up but refund not received,refund_status,"Return received 2026-06-05. Refund of ₹2,499 initiated 2026-06-07 via UPI. Expected by 2026-06-14 (5–7 business days).","I checked Order ORD-4582. Your return was received on 2026-06-05, and your refund of ₹2,499 was initiated on 2026-06-07 to your UPI. Refunds to UPI take 5-7 business days after refund initiation, so you should receive it by 2026-06-14.",Grounded,Answer is supported by available data. Key facts match mock data.,No fix needed. Answer is correct and grounded in data.,276.76,48,9.6e-05,"order, return, refund, policy"
2026-06-09T18:45:21.810164,ORD-5119,Why did I get a partial refund?,partial_refund,"Partial refund of ₹1,249 issued (50% of ₹2,499) because item was returned in damaged condition. Initiated 2026-06-08, expected by 2026-06-15.","For Order ORD-5119, a partial refund of ₹1,249 was issued instead of the full ₹2,499. Reason: Item returned in damaged condition. Per policy, 50% refund applied.",Incomplete,"Answer exists but omits key fields: initiation date, expected completion date. Customer can't determine when or how much to expect.","Update prompt to always include: refund amount, initiation date, payment method, and expected timeline when available.",463.64,33,6.6e-05,"order, refund"
2026-06-09T18:45:21.810243,ORD-6670,Can I cancel my order after it was shipped?,cancel_order,"Order ORD-6670 has already shipped. Cannot cancel. Wait for delivery, then initiate a return within 10 days of delivery.","Order ORD-6670 has already been shipped. Cannot cancel. Wait for delivery, then initiate return within 10 days. Once delivered, you can initiate a return within the 10 days from delivery.",Grounded,Answer is supported by available data. Key facts match mock data.,No fix needed. Answer is correct and grounded in data.,416.39,39,7.8e-05,"order, policy"
2026-06-09T18:45:21.810270,ORD-3891,What is the status of my return?,general_refund_query,"Return pickup scheduled for 2026-06-10. Once received, refund will be initiated within 1–2 business days. Credit Card refunds take 7–10 business days.",I can see activity on your account but need more details. Could you share your order ID so I can give you an exact update?,Grounded,Answer is supported by available data. Key facts match mock data.,No fix needed. Answer is correct and grounded in data.,328.06,32,6.4e-05,none
2026-06-09T18:45:21.810292,ORD-2244,When will I get my refund?,refund_status,"Refund of ₹8,999 completed on 2026-05-26 to your Debit Card.","I checked Order ORD-2244. Your return was received on 2026-05-22, and your full refund of ₹8,999 was completed on 2026-05-26 to your Debit Card.",Grounded,Answer is supported by available data. Key facts match mock data.,No fix needed. Answer is correct and grounded in data.,334.29,30,6e-05,"order, return, refund"
2026-06-09T18:45:21.810320,ORD-2244,Did my refund go through?,refund_status,"Refund of ₹8,999 completed on 2026-05-26 to your Debit Card.","I checked Order ORD-2244. Your return was received on 2026-05-22, and your full refund of ₹8,999 was completed on 2026-05-26 to your Debit Card.",Grounded,Answer is supported by available data. Key facts match mock data.,No fix needed. Answer is correct and grounded in data.,377.25,29,5.8e-05,"order, return, refund"
2026-06-09T18:45:21.810352,ORD-5119,When will the refund be credited?,refund_timeline,"Partial refund of ₹1,249 issued (50% of ₹2,499) because item was returned in damaged condition. Initiated 2026-06-08, expected by 2026-06-15.","I checked Order ORD-5119. Your return was received on 2026-06-07, and your refund of ₹1,249 was initiated on 2026-06-08 to your UPI. Refunds to UPI take 5-7 business days after refund initiation, so you should receive it by 2026-06-15.",Grounded,Answer is supported by available data. Key facts match mock data.,No fix needed. Answer is correct and grounded in data.,149.49,45,9e-05,"order, return, refund, policy"
2026-06-09T18:45:21.810401,ORD-4582,Where is my refund?,refund_status,"Return received 2026-06-05. Refund of ₹2,499 initiated 2026-06-07 via UPI. Expected by 2026-06-14 (5–7 business days).",Your refund has already been completed. Please check your bank account.,Hallucinated,"AI implied the refund was completed or processed, but mock data shows refund_status = 'initiated'. This is a factual error the customer would act on incorrectly.",Add a data validation gate: block final answer generation unless required API fields are present and verified.,460.78,15,3e-05,none
2026-06-09T18:45:21.810455,ORD-6670,Can I cancel my order?,cancel_order,"Order ORD-6670 has already shipped. Cannot cancel. Wait for delivery, then initiate a return within 10 days of delivery.",Your order has been successfully cancelled. Refund will arrive in 2 hours.,Hallucinated,"AI claimed the order was cancelled, but order_status = 'shipped'. Cancellation is not possible at this stage.",Add a data validation gate: block final answer generation unless required API fields are present and verified.,316.16,17,3.4e-05,none
2026-06-09T18:45:21.810471,ORD-4582,When will I get money back?,refund_status,"Return received 2026-06-05. Refund of ₹2,499 initiated 2026-06-07 via UPI. Expected by 2026-06-14 (5–7 business days).","Your refund of ₹5,000 has been processed to your Credit Card.",Hallucinated,"AI implied the refund was completed or processed, but mock data shows refund_status = 'initiated'. This is a factual error the customer would act on incorrectly.",Add a data validation gate: block final answer generation unless required API fields are present and verified.,336.79,17,3.4e-05,none
2026-06-09T18:45:21.810485,ORD-4582,When will I get my money back?,refund_status,"Return received 2026-06-05. Refund of ₹2,499 initiated 2026-06-07 via UPI. Expected by 2026-06-14 (5–7 business days).",Your refund has been initiated.,Incomplete,"Answer is too brief (5 words) given available data. Missing: refund amount, initiation date, expected completion date.","Update prompt to always include: refund amount, initiation date, payment method, and expected timeline when available.",328.24,12,2.4e-05,none
2026-06-09T18:45:21.810504,ORD-5119,What is my refund status?,refund_status,"Partial refund of ₹1,249 issued (50% of ₹2,499) because item was returned in damaged condition. Initiated 2026-06-08, expected by 2026-06-15.",Please wait for the refund to be processed.,Incomplete,"Answer is too brief (8 words) given available data. Missing: refund amount, initiation date, expected completion date.","Update prompt to always include: refund amount, initiation date, payment method, and expected timeline when available.",175.41,13,2.6e-05,none
2026-06-09T18:45:21.810522,ORD-3891,When will my refund come?,refund_status,"Return pickup scheduled for 2026-06-10. Once received, refund will be initiated within 1–2 business days. Credit Card refunds take 7–10 business days.",I cannot find the complete details. Please try again later.,Uncertain,"Answer is vague even though the order, return, and refund data are all present in the system. The AI had enough information to answer.","Add a clarifying-question flow when order ID is missing. If data is available but answer is vague, route to human support.",305.56,15,3e-05,none
2026-06-09T18:45:21.810536,ORD-4582,How long will the refund take?,refund_timeline,"Return received 2026-06-05. Refund of ₹2,499 initiated 2026-06-07 via UPI. Expected by 2026-06-14 (5–7 business days).",I'm not sure about the exact status. Please contact customer support.,Uncertain,"Answer is vague even though the order, return, and refund data are all present in the system. The AI had enough information to answer.","Add a clarifying-question flow when order ID is missing. If data is available but answer is vague, route to human support.",134.31,17,3.4e-05,none
